{
  "$schema": "https://json-schema.org/draft/2020-12/schema",
  "$id": "https://schemas.stravica.io/rcf/v0.6.0/fbs.schema.json",
  "title": "RCF Functional Build Spec",
  "description": "Functional Build Specification. One per build session. Carries the mandatory bsId parent reference plus buildOrder and executionStatus. Owns its acIds[] scope (Acceptance Criteria delivered by this FBS) and its dependsOnFbsIds[] graph edge (other FBSs this one depends on). From 0.4.4 the contextRequirements block carries an optional standardIds[] array. It is the host for the bundle assembler's selective-retrieval step: the assembler analyses the FBS work text against the manifest.standards[] tag vocabulary and populates standardIds for that bundle only, or honours an operator override authored on the FBS. From 0.7.0 the FBS additionally carries an optional journeyStepIds[] array: discovery journey step ids (JNY-nnn-nnn) owned by the discovery journey record that this build unit delivers, so the build-review surface can detect unbound discovery steps and unbound UI-bearing build specs. Every added field is optional; pre-0.4.4 FBSes remain valid.",
  "type": "object",
  "additionalProperties": false,
  "required": [
    "fbsId",
    "prdId",
    "bsId",
    "buildOrder",
    "executionStatus",
    "title",
    "summary",
    "acIds",
    "dependsOnFbsIds",
    "createdAt",
    "updatedAt"
  ],
  "properties": {
    "fbsId": { "$ref": "https://schemas.stravica.io/rcf/v0.6.0/common.schema.json#/$defs/fbsId" },
    "prdId": { "$ref": "https://schemas.stravica.io/rcf/v0.6.0/common.schema.json#/$defs/prdId" },
    "bsId": { "$ref": "https://schemas.stravica.io/rcf/v0.6.0/common.schema.json#/$defs/bsId" },
    "buildOrder": { "type": "integer", "minimum": 1 },
    "executionStatus": { "$ref": "https://schemas.stravica.io/rcf/v0.6.0/common.schema.json#/$defs/executionStatus" },
    "title": { "type": "string", "minLength": 1 },
    "summary": { "type": "string", "minLength": 1 },
    "approach": { "type": "string" },
    "acIds": {
      "type": "array",
      "minItems": 1,
      "items": { "$ref": "https://schemas.stravica.io/rcf/v0.6.0/common.schema.json#/$defs/acId" }
    },
    "dependsOnFbsIds": {
      "type": "array",
      "minItems": 0,
      "items": { "$ref": "https://schemas.stravica.io/rcf/v0.6.0/common.schema.json#/$defs/fbsId" }
    },
    "journeyStepIds": {
      "type": "array",
      "items": { "type": "string", "minLength": 1 },
      "uniqueItems": true,
      "description": "Discovery journey step ids (shape JNY-nnn-nnn, owned by the discovery journey record at rcf/discovery/journey.json) that this build unit delivers. Written at Define by the author or the discovery binder; read by the build-review surface so a UI-bearing FBS that leaves a journey step unbound, or a discovery step with no FBS binding, raises a journeyStub review finding. Optional; pre-0.7.0 FBSes keep validating with no journeyStepIds field present."
    },
    "contextRequirements": {
      "type": "object",
      "additionalProperties": false,
      "properties": {
        "prdSections": {
          "type": "array",
          "items": { "type": "string" }
        },
        "tadSections": {
          "type": "array",
          "items": { "type": "string" }
        },
        "tacIds": {
          "type": "array",
          "items": { "$ref": "https://schemas.stravica.io/rcf/v0.6.0/common.schema.json#/$defs/tacId" }
        },
        "adrIds": {
          "type": "array",
          "items": { "$ref": "https://schemas.stravica.io/rcf/v0.6.0/common.schema.json#/$defs/adrId" }
        },
        "standardIds": {
          "type": "array",
          "items": { "$ref": "https://schemas.stravica.io/rcf/v0.6.0/common.schema.json#/$defs/standardSlug" },
          "description": "Standards-pack slugs (from manifest.standards[]) that apply to this FBS. Populated by the bundle assembler's agentic selective-retrieval step at bundle-assembly time; an operator-authored value overrides the agentic selection for that FBS. Empty or absent means no standards content is included in the bundle; the assembler never blocks on an empty selection."
        },
        "existingModules": {
          "type": "array",
          "items": { "type": "string" }
        },
        "schemas": {
          "type": "array",
          "items": { "type": "string" }
        },
        "externalDocs": {
          "type": "array",
          "items": { "type": "string" }
        },
        "other": {
          "type": "array",
          "items": { "type": "string" }
        }
      }
    },
    "estimatedSize": { "enum": ["small", "medium", "large"] },
    "estimatedHours": { "type": "number", "minimum": 0.5, "maximum": 16 },
    "deliverables": {
      "type": "array",
      "items": { "type": "string" }
    },
    "riskLevel": { "enum": ["low", "medium", "high"] },
    "domain": { "type": "string" },
    "notes": { "type": "string" },
    "noCodeNodes": {
      "type": "boolean",
      "description": "Declares this build spec produces no traceable code (docs-only or config-only). rcf build --mark complete records it via --no-code-nodes and the CodeNode gate skips the spec."
    },
    "dependsOnServices": {
      "type": "array",
      "items": { "$ref": "#/$defs/serviceDependency" },
      "description": "Third-party services this FBS's work depends on, and how each dependency is intended to be attested by tests. Written at Define stage from the pre-flight config record. Optional at schema; build-side coverage-strict is what enforces the attestation matrix."
    },
    "uiBearing": {
      "type": "boolean",
      "description": "True when this FBS renders UI for a person. Written by the classifier at Define, or by the operator via rcf update. When true, --mark complete refuses without designStageComplete: true."
    },
    "uiClassification": { "$ref": "#/$defs/uiClassification" },
    "designStage": { "$ref": "#/$defs/designStage" },
    "designStageComplete": {
      "type": "boolean",
      "description": "Set to true by the Design worker or by rcf design --mark-complete once journeys, navModel, and themeAndA11y are authored and the operator considers the design settled. Gates the --mark complete transition on uiBearing FBSes."
    },
    "createdAt": { "$ref": "https://schemas.stravica.io/rcf/v0.6.0/common.schema.json#/$defs/timestamp" },
    "updatedAt": { "$ref": "https://schemas.stravica.io/rcf/v0.6.0/common.schema.json#/$defs/timestamp" }
  },
  "$defs": {
    "serviceDependency": {
      "type": "object",
      "additionalProperties": false,
      "required": ["id", "displayName", "purpose", "attestationMode", "acIds"],
      "properties": {
        "id": {
          "type": "string",
          "pattern": "^[a-z][a-zA-Z0-9]*$",
          "description": "Canonical service id in camelCase, matching the pre-flight config record entry for this service."
        },
        "displayName": {
          "type": "string",
          "minLength": 1,
          "description": "Human-readable service name (for example, Resend email API)."
        },
        "purpose": {
          "type": "string",
          "minLength": 1,
          "description": "What this FBS uses the service for."
        },
        "attestationMode": { "$ref": "https://schemas.stravica.io/rcf/v0.6.0/common.schema.json#/$defs/attestationMode" },
        "acIds": {
          "type": "array",
          "minItems": 1,
          "items": { "$ref": "https://schemas.stravica.io/rcf/v0.6.0/common.schema.json#/$defs/acId" },
          "description": "Acceptance criteria within this FBS's scope that this service dependency governs. An FBS may span mixed services."
        },
        "preFlightRef": {
          "type": "string",
          "minLength": 1,
          "description": "Pointer into the pre-flight config record (for example pfc-2026-07-30-001#services.resend). Provenance for how the attestation mode was chosen."
        }
      }
    },
    "uiClassification": {
      "type": "object",
      "additionalProperties": false,
      "required": ["verdict", "reason", "classifiedAt"],
      "properties": {
        "verdict": {
          "enum": ["ui", "notUi", "operatorOverride"],
          "description": "Classifier verdict. ui: the FBS renders HTML for a person. notUi: no visible rendering. operatorOverride: the operator ruled against the classifier's opinion."
        },
        "reason": {
          "enum": ["keyword-scan", "operator-tag", "inheritedFromParent", "operatorOverride"],
          "description": "How the verdict was reached."
        },
        "signals": {
          "type": "array",
          "items": { "$ref": "#/$defs/uiClassificationSignal" },
          "description": "Matched signals when reason is keyword-scan."
        },
        "classifiedAt": { "$ref": "https://schemas.stravica.io/rcf/v0.6.0/common.schema.json#/$defs/timestamp" }
      },
      "description": "Provenance for the UI-bearing classifier verdict on this FBS."
    },
    "uiClassificationSignal": {
      "type": "object",
      "additionalProperties": false,
      "required": ["source", "match"],
      "properties": {
        "source": {
          "enum": ["summary", "ac.description", "us.iWant", "us.soThat", "req.description"],
          "description": "Which text field the signal was matched in."
        },
        "acId": { "$ref": "https://schemas.stravica.io/rcf/v0.6.0/common.schema.json#/$defs/acId" },
        "match": {
          "type": "string",
          "minLength": 1,
          "description": "The matched substring."
        }
      }
    },
    "designStage": {
      "type": "object",
      "additionalProperties": false,
      "properties": {
        "journeys": {
          "type": "array",
          "minItems": 1,
          "items": { "$ref": "#/$defs/designJourney" },
          "description": "Walk-throughs describing how a person progresses through the UI. At least one entry when the block is present."
        },
        "navModel": { "$ref": "#/$defs/designNavModel" },
        "themeAndA11y": { "$ref": "#/$defs/designThemeAndA11y" },
        "authoredAt": { "$ref": "https://schemas.stravica.io/rcf/v0.6.0/common.schema.json#/$defs/timestamp" },
        "authoredBy": {
          "type": "string",
          "minLength": 1,
          "description": "The worker or operator label that authored the block."
        }
      },
      "description": "Design substage artefacts (journeys, navigation model, theme and accessibility). All sub-fields are required-when-present in practice; the schema keeps them optional so partial drafts still validate during authoring."
    },
    "designJourney": {
      "type": "object",
      "additionalProperties": false,
      "required": ["id", "actor", "goal", "steps"],
      "properties": {
        "id": {
          "type": "string",
          "pattern": "^[a-z][a-z0-9-]*$",
          "description": "Lowercase slug identifying the journey within the FBS."
        },
        "actor": {
          "type": "string",
          "minLength": 1,
          "description": "The person the journey belongs to (for example, signed-in owner)."
        },
        "goal": {
          "type": "string",
          "minLength": 1,
          "description": "One-line statement of what the actor is trying to achieve."
        },
        "steps": {
          "type": "array",
          "minItems": 2,
          "maxItems": 8,
          "items": { "type": "string", "minLength": 1 },
          "description": "Short strings walking through the journey. Two to eight entries."
        }
      }
    },
    "designNavModel": {
      "type": "object",
      "additionalProperties": false,
      "required": ["shape", "routes"],
      "properties": {
        "shape": {
          "enum": ["shared-persistent", "shared-per-section", "none-single-page", "operator-declared-other"],
          "description": "Overall navigation shape. shared-persistent: one nav on every authenticated route. shared-per-section: consistent nav per section. none-single-page: single-route app. operator-declared-other: anything else; requires notes."
        },
        "routes": {
          "type": "array",
          "minItems": 1,
          "items": { "$ref": "#/$defs/designNavRoute" }
        },
        "signedInAsAffordance": {
          "type": "boolean",
          "description": "Whether a visible signed-in-as affordance is required on authenticated routes."
        },
        "notes": {
          "type": "string",
          "description": "Free text; required in practice when shape is operator-declared-other."
        }
      }
    },
    "designNavRoute": {
      "type": "object",
      "additionalProperties": false,
      "required": ["path", "label", "authRequired"],
      "properties": {
        "path": { "type": "string", "minLength": 1 },
        "label": { "type": "string", "minLength": 1 },
        "authRequired": { "type": "boolean" }
      }
    },
    "designThemeAndA11y": {
      "type": "object",
      "additionalProperties": false,
      "required": ["themeMode", "themeTokensModule", "contrastTargets", "contrastTestPath", "contrastTestAuthoredBeforePalette"],
      "properties": {
        "themeMode": {
          "enum": ["light-default-with-toggle", "dark-default-with-toggle", "single-theme-declared"],
          "description": "Theme posture for the FBS. Default across the estate is light-default-with-toggle."
        },
        "themeTokensModule": {
          "type": "string",
          "minLength": 1,
          "description": "Project-relative path to the design tokens module (for example src/ui/tokens.ts)."
        },
        "contrastTargets": {
          "type": "string",
          "minLength": 1,
          "description": "Short statement of the contrast targets (for example, WCAG AA 4.5 text, 3.0 large text, 3.0 UI component)."
        },
        "contrastTestPath": {
          "type": "string",
          "minLength": 1,
          "description": "Project-relative path to the contrast test."
        },
        "contrastTestAuthoredBeforePalette": {
          "type": "boolean",
          "description": "Operator attestation that the contrast test was authored before the palette. Corroborated by git history at Stage 2 when history is available; the boolean stands alone when history is inconclusive."
        }
      }
    }
  }
}
