{
  "fbsId": "FBS-011",
  "prdId": "PRD-001",
  "bsId": "BS-001",
  "buildOrder": 11,
  "executionStatus": "inProgress",
  "title": "Email channel via Resend",
  "summary": "Route recovery emails through the Resend transactional API.",
  "acIds": ["AC-1001-2"],
  "dependsOnFbsIds": [],
  "dependsOnServices": [
    {
      "id": "resend",
      "displayName": "Resend email API",
      "purpose": "outbound transactional email delivery",
      "attestationMode": "live",
      "acIds": ["AC-1001-2"],
      "preFlightRef": "pfc-2026-07-30-001#services.resend"
    }
  ],
  "createdAt": "2026-07-30T14:20:00Z",
  "updatedAt": "2026-07-30T14:20:00Z"
}
